"","Term","Definition"
"477","modified radical hysterectomy","Surgery to remove the uterus (including the cervix). A half inch or less of the vagina is also removed. Some of the connective tissue and fat surrounding the cervix is also removed."
"478","neuroendocrine carcinoma of the cervix (NECC)","A rare and often aggressive subtype of cervical cancer."
"479","neuropathy","A nerve problem that causes pain, tingling, and numbness in the hands and feet."
"480","oophoropexy","Surgery that moves one or both ovaries out of the range of the radiation beam. Also called ovarian transposition."
"481","parametrium","The fat and connective tissue surrounding the uterus. The parametrium helps connect the uterus to other tissues in the pelvis."
"482","pelvic exam","A physical exam of the external genitalia, vagina, cervix, uterus, fallopian tubes, and ovaries."
"483","pelvic exenteration","A radical surgery used to treat cervical cancer that returns to the pelvis. The uterus (including the cervix), vagina, ovaries, and fallopian tubes are removed. The bladder, rectum, and/or anus may also be removed."
"484","platinum-based chemotherapy","Treatment with two or more chemotherapy drugs and the main drug is made with platinum."
"485","radical hysterectomy","Surgery to remove the uterus (including the cervix) and the top quarter or third of the vagina. The connective tissue and fat surrounding the cervix is also removed."
"486","radiologist","A doctor who is an expert in interpreting imaging tests."
"487","squamo-columnar junction","The area where the endocervix and ectocervix meet. Also called the transformation zone. Most cervical cancers and pre-cancers start in the squamo-columnar junction."
"488","surgical menopause","The stopping of menstrual periods caused by surgery to remove the ovaries."
"489","trachelectomy","Surgery to remove the cervix. The upper part of the vagina and certain pelvic lymph nodes may also be removed."
"490","uterus","The organ where a fetus grows and develops during pregnancy. Also called the womb."
"491","vagina","The hollow, muscular tube through which babies are born. Also called the birth canal."
"492","Ablation","A type of local therapy used to destroy tumors in the liver or lungs. Also called image-guided thermal ablation."
"493","Adenocarcinoma","Cancer in cells that line organs and make fluids or hormones. The most common type of colon cancer."
"494","Adenoma","The most common type of colon polyp. Most likely to form cancer cells. Also called adenomatous polyps."
"495","Biomarkers","Specific features of cancer cells used to guide treatment. Biomarkers are often mutations (changes) in the DNA of the cancer cells."
"496","CAPEOX","A chemotherapy regimen that includes capecitabine and oxaliplatin."
"497","Carcinoembryonic antigen (CEA)","A protein that gets released by some tumors and can be detected in blood."
"498","Carcinoma in situ","Abnormal cells on the innermost layer of the colon wall. These cells may become cancer and spread into deeper layers of the colon wall."
"499","Colectomy","Surgery to remove a part of the colon."
"500","Colon","The first and longest section of the large bowel. Unused food is turned into stool in the colon."
"501","Colonoscopy","Insertion of a thin tool into the colon to view or remove tissue."
"502","Colostomy","Surgery to connect a part of the colon to the outside of the abdomen and that allows stool to drain into a bag."
"503","Embolization","Blockage of blood flow to a tumor with beads that emit either chemotherapy or radiation."
"504","Familial adenomatous polyposis (FAP)","An inherited cancer syndrome that increases the risk of colon cancer."
"505","FOLFIRI","A chemotherapy regimen used for some advanced colon cancers. Includes leucovorin calcium, fluorouracil, and irinotecan."
"506","FOLFIRINOX","A chemotherapy regimen used for some advanced colon cancers. Includes leucovorin calcium (folinic acid), fluorouracil, irinotecan, and oxaliplatin."
"507","FOLFOX","A chemotherapy regimen that includes leucovorin calcium, fluorouracil, and oxaliplatin."
"508","Interventional oncology/radiology","A medical specialty that uses imaging techniques to deliver minimally invasive cancer treatments."
"509","Large intestine (bowel)","A long tube-shaped organ that forms the last part of the digestive system. Includes the colon, rectum, and anus."
"510","Lymphadenectomy","Surgery to remove lymph nodes."
"511","Metastasectomy","Surgery to remove cancer that has spread far from the first tumor."
"512","Mismatch repair deficiency (dMMR)/high microsatellite instability (MSI-H)","A biomarker (feature) of some colon cancers that is used to guide treatment. All colon cancers should be tested for this biomarker."
"513","Mismatch repair proficient (pMMR)/microsatellite stable (MSS)","Describes cancers that do not have the mismatch repair deficiency (dMMR) biomarker."
"514","POLE/POLD1 mutation","A biomarker (feature) of some colon cancers. Recommended as part of comprehensive biomarker testing for metastatic colon cancer."
"515","Polyp","An overgrowth of cells on the inner lining of the colon wall. Pedunculated polyps are shaped like mushrooms with a stalk. Sessile polyps are flat."
"516","Portal vein embolization","A minimally invasive procedure to enlarge the healthy part of the liver before a liver resection."
"517","Stereotactic body radiation therapy (SBRT)","A specialized type of radiation therapy used to treat colon cancer that has spread to the liver, lungs, or bone."
"518","Unresectable","Cancer that cannot be removed safely by surgery."
