"","Term","Definition"
"2","adolescents and young adults (AYA)","People who are 15 to 39 years of age."
"3","biomarker testing","A lab test of any molecule in your body that can be measured to assess your health. Also called molecular testing."
"4","biopsy","A procedure that removes fluid or tissue samples to be tested for a disease."
"5","chromosome","The structures within cells that contain coded instructions for cell behavior."
"6","clinical trial","A type of research that assesses health tests or treatments."
"7","ejaculate","A mix of sperm and fluids. Also called semen."
"8","fertility","The ability to produce children."
"9","fertility preservation","A way to preserve or protect the ability to become pregnant and have a baby."
"10","gene","Coded instructions in cells for making new cells and controlling how cells behave."
"11","genetic mutation","An abnormal change in the coded instructions within cells."
"12","gynecologic oncologist","A doctor who’s an expert in reproductive cancers of those assigned female at birth."
"13","hormone","A chemical in the body that triggers a response from cells or organs."
"14","inherited mutation","A mutation passed on from parent to a child that is present before birth."
"15","in vitro fertilization (IVF)","Procedure that removes eggs from the ovaries and combines them with sperm for fertilization in a lab."
"16","medical oncologist","A doctor who treats cancer in adults using systemic therapy."
"17","menopause","The end of menstrual periods."
"18","mutation","An abnormal change in the instructions within cells for making and controlling cells."
"19","oncofertility","Cancer doctors and reproductive experts who work together to help people keep their ability to have babies."
"20","oncologist","A doctor who’s an expert in the treatment of cancer."
"21","oocyte preservation","The process of freezing one or more unfertilized eggs (eggs that have not been combined with sperm) to save them for future use. Also called egg banking, egg cryopreservation, and egg freezing."
"22","ovarian suppression","Methods used to lower hormone levels made by the ovaries."
"23","ovary","One of a pair of glands that produce eggs and hormones. There is one ovary on each side of the uterus."
"24","pathologist","A doctor who’s an expert in testing cells and tissue to find disease."
"25","prognosis","The pattern and outcome of a disease."
"26","psychosocial","Having to do with the mental, emotional, social, and spiritual aspects."
"27","psychosocial support","Support given to help meet the mental, emotional, social, and spiritual needs. Types of psychosocial support include counseling, education, group support, and spiritual support."
"28","radiation oncologist","A doctor who’s an expert in treating cancer with radiation."
"29","radiation therapy","A treatment that uses high-energy radiation from x-rays, gamma rays, neutrons, protons, and other sources to kill cancer cells and shrink tumors."
"30","recurrence","The return of cancer after a cancer-free period."
"31","refractory cancer","A cancer that does not improve with treatment."
"32","relapse","The return or worsening of cancer after a period of improvement."
"33","reproductive system","The group of organs that work together to make a baby. They include the vagina, cervix, uterus, fallopian tubes, ovaries, penis, testicles, and prostate."
"34","semen","The fluid that is released through the penis during orgasm. Semen is made up of sperm from the testicles and fluid from the prostate and other sex glands. Also called ejaculate."
"35","side effect","An unhealthy or unpleasant physical or emotional response to treatment."
"36","sperm","Cell formed in the testicle."
"37","sperm aspiration","A procedure in which a sample of sperm cells is removed from the testicle through a small needle attached to a syringe."
"38","sperm banking","The process of freezing sperm and storing it for future use. Samples of semen are collected and checked under a microscope in the laboratory to count sperm cells and find out how healthy they are. The sperm cells are then frozen and stored. Also called sperm cryopreservation."
"39","sperm count","A count of the number of sperm in a sample of semen. A sperm count may be used as a measure of fertility."
"40","stem cell transplant (SCT)","A cancer treatment that replaces abnormal blood stem cells with healthy cells. Also called hematopoietic cell transplant (HCT) or bone marrow transplant (BMT)."
"41","3D-CRT","Three-dimensional conformal radiation therapy."
"42","adenocarcinoma","A cancer of cells that line organs and make fluids or hormones."
"43","adjuvant treatment","Treatment that is given after the main treatment to prevent the cancer from returning."
"44","alveoli","The tiny sacs in the lungs where gases are transferred in and out of the blood."
"45","board certified","A status for doctors who finished training and passed exams in a specialized field of medicine."
"46","body plethysmograph","A test of how much air is in your lungs after inhaling or exhaling."
"47","bronchioli","Small airways within the lungs."
"48","bronchoscope","A device that is guided down the throat to look inside the airways."
"49","bronchoscopy","A procedure to look inside the airways with a device that is guided down the throat."
"50","bronchus","One of the two main airways that extends into the lungs."
"51","cancer screening","Routine testing for cancer in people without symptoms."
"52","cancer stage","A rating of the outlook of a cancer based on its growth and spread."
"53","carcinoma","A cancer of cells that line the inner or outer surfaces of the body."
"54","chemistry profile","A lab test of the amount of 8 chemicals in a sample of blood. Also called metabolic panel."
"55","chemoimmunotherapy","A combined treatment with both chemotherapy and immunotherapy."
"56","chemoradiation","A cancer treatment with both cell-killing drugs and high-energy rays."
"57","chemotherapy","Treatment with cancer drugs that kill fast-growing cells."
"58","chest wall","The layer of muscle, bone, and fat that protects the vital organs."
"59","chronic obstructive pulmonary disease (COPD)","Lung damage or too much mucus that makes breathing hard."
"60","clinical stage","The rating of the extent of cancer before treatment is started."
"61","complete blood count (CBC)","A lab test that measures the parts of the blood."
"62","computed tomography (CT)","A test that uses x-rays from many angles to make a picture of the insides of the body."
"63","contrast","A substance put into your body to make clearer pictures during imaging."
"64","diagnosis","An identification of an illness based on tests."
"65","endobronchial ultrasound (EBUS)","A procedure that takes detailed pictures inside the body with a device guided down the windpipe."
"66","endoscopic ultrasound (EUS)","A procedure that takes detailed pictures inside the body with a device guided down the throat."
"67","esophagus","The tube-shaped organ between the mouth and stomach."
"68","external beam radiation therapy (EBRT)","Radiation therapy received from a machine outside the body."
"69","FDA","Food and Drug Administration."
"70","FDG","Fluorodeoxyglucose."
"71","four-dimensional computed tomography (4D-CT)","A test that makes a video of the inside of your body."
"72","gas diffusion","A test that uses harmless gas to measure how much you breathe out."
"73","immunotherapy","A drug treatment that helps the body's immune system find and destroy cancer cells."
"74","intensity-modulated radiation therapy (IMRT)","Treatment with radiation that uses small beams of different strengths."
"75","invasion","The growth of cancer from where it started into another type of tissue."
"76","large-cell lung carcinoma","A cancer of lung cells that lack features to classify as another type of lung cancer."
"77","lobe","A clearly seen division in an organ."
"78","lobectomy","An operation that removes a whole lobe of an organ."
"79","low-dose computed tomography (LDCT)","A test that uses small amounts of radiation to make pictures of the insides of the body."
"80","lymph node","A small, bean-shaped, disease-fighting structure."
"81","magnetic resonance imaging (MRI)","A test that uses radio waves and powerful magnets to make pictures of the insides of the body."
"82","mediastinoscopy","A procedure to do work in the chest with a device passed through a small cut in the skin."
"83","mediastinum","The area of the chest between the lungs."
"84","medical history","A report of all your health events and medications."
"85","metastasis","The spread of cancer from the first tumor to a new site."
"86","navigational bronchoscopy","A procedure to do work in the smallest airways with a device guided down the windpipe."
"87","NCCN","National Comprehensive Cancer Network."
"88","neoadjuvant therapy","A cancer treatment that is given before the main treatment."
"89","nodule","A small mass of tissue."
"90","non-small cell lung cancer (NSCLC)","A cancer that starts in lung cells that are not small."
"91","non-solid nodule","A small tissue mass of low density."
"92","part-solid nodule","A small tissue mass with areas of low and high density."
"93","pathologic stage","A rating of the extent of cancer based on tests given after treatment."
"94","physical exam","A review of the body by a health expert for signs of disease."
"95","pneumonectomy","An operation that removes the entire lung."
"96","positron emission tomography (PET)","A test that uses radioactive material to see the shape and function of body parts."
"97","positron emission tomography/computed tomography (PET/CT)","A test that uses two picture-making methods to show the shape and function of tissue."
"98","primary tumor","The main mass of a certain type of cancer cell."
"99","proton therapy","Radiation therapy that uses protons to treat a disease. Also called hadron therapy."
"100","pulmonary function tests","A set of breathing tests to test the strength of the lungs."
"101","pulmonologist","A doctor who’s an expert in lung diseases."
"102","radial endobronchial ultrasound (EBUS) bronchoscopy","A procedure to do work inside the lung with an imaging device guided down the windpipe."
"103","respiratory system","The group of organs that transfers gases in and out of the body."
"104","robot-assisted thoracoscopic surgery (RATS)","A method to perform a surgery called thoracoscopy."
"105","ROSE","Rapid on-site evaluation."
"106","segmentectomy","An operation that removes a large part of a lobe."
"107","sleeve lobectomy","An operation to remove an entire lobe and part of the bronchus."
"108","small cell lung cancer","A cancer of small lung cells."
"109","solid nodule","A small mass of tissue of high density."
"110","spirometry","A test that uses a tube to measure how fast you breathe."
"111","squamous cell carcinoma","A type of cancer of thin and flat cells that line the surface of organs."
"112","stereotactic ablative radiotherapy (SABR)","Treatment with high-dose radiation within one or a few sessions. Also called SBRT."
"113","superior sulcus tumor","A mass of cancer cells that starts at the top of the lung and easily grows into the chest wall."
"114","supportive care","Cancer care that includes symptom relief but not cancer treatment. Also sometimes called palliative care."
"115","surgery","An operation to remove or repair a part of the body."
"116","surgical margin","The normal-looking tissue around a tumor that was removed during an operation."
"117","survivorship care","Interventions to improve the health and well-being of people who have or had cancer."
"118","thoracic radiologist","A doctor who’s an expert in reading imaging tests of the chest."
"119","targeted therapy","A drug treatment that impedes the growth process specific to cancer cells."
"120","thoracic surgeon","A doctor who’s an expert in operating on organs inside the chest."
"121","three-dimensional conformal radiation therapy (3D-CRT)","A treatment with radiation that uses beams matched to the shape of the tumor."
"122","transthoracic needle aspiration (TTNA)","A procedure that removes tissue samples with a thin needle guided through the ribs."
"123","ultrasound","A test that uses sound waves to take pictures of the inside of the body."
"124","wedge resection","An operation that removes a small part of a lobe."
"125","adjuvant therapy","Treatment that is given after surgery to lower the chances of the cancer returning."
"126","adrenal gland","A small organ on top of each kidney that makes hormones."
"127","aggressive cancer","A cancer that grows or spreads fast."
"128","allergic reaction","An abnormal response by the body to a foreign substance that is harmless."
"129","anus","The opening of the intestinal tract between the legs through which stool passes out of the body."
"130","appendix","A small tube-like organ attached to the first section of the large intestine."
"131","biochemical test","A test to measure the level of chemicals in the body."
"132","bronchopulmonary","A term used for the airways that lead to the lungs (bronchi and pulmonary)."
"133","cancer grade","A rating of how much cancer cells look like normal cells."
"134","carcinoid syndrome","A group of symptoms that happen when carcinoid tumors release serotonin and other chemicals into the blood."
"135","carcinoid tumor","A neuroendocrine tumor found most commonly in the gastrointestinal tract, lungs, bronchi, thymus, and other areas in the body. It may secrete the hormone serotonin and other chemicals."
"136","colon","The hollow organ in which eaten food turns from a liquid into a solid form."
"137","cortisol","A hormone that controls blood sugar, metabolism, and other functions in the body."
"138","Cushing syndrome","A condition caused by the release of excess cortisol in the body."
"139","deoxyribonucleic acid (DNA)","A chain of chemicals in cells that contains coded instructions for making and controlling cells. Also called the “blueprint of life.”"
"140","duodenum","A part of the digestive tract that receives food from the stomach and mixes it with digestive juices."
"141","endoscope","A device that is passed through a natural opening to do work inside the body."
"142","enucleation","Removal of an organ or tumor in such a way that it comes out clean and whole, like a nut from its shell."
"143","first-line or front-line therapy","The first drug or set of drugs given to treat cancer."
"144","gastrin","A hormone made and released by the stomach."
"145","gastrointestinal (GI) tract","The group of organs through which food passes after being eaten. Also called digestive tract."
"146","genetic testing","A lab test (usually performed on blood or saliva) to identify abnormal genes that impact your risk of developing cancer."
"147","glucagon","A hormone made by the pancreas that works with insulin to control blood sugar levels."
"148","hereditary","Passed down from parent to child through coded information in cells."
"149","hives","A skin rash caused by the body trying to rid itself of a foreign substance."
"150","hypothalamus","A part of the brain that works with the nervous system and glands that make hormones in the body."
"151","ileum","The last section of the small intestine."
"152","imaging","A test that makes pictures (images) of the insides of the body."
"153","immune system","The body’s natural defense against infection and disease."
"154","insulin","A chemical that controls the amount of sugar in the blood. It lowers the blood sugar levels."
"155","jejunum","The middle section of the small intestine."
"156","liver","The largest organ and gland in the body with many vital functions."
"157","lung","One of a pair of organs that consists of airways and air sacs."
"158","multiple endocrine neoplasia (MEN)","An inherited syndrome that causes tumors to grow in the glands of the endocrine system."
"159","neoadjuvant treatment","A treatment given before the main treatment to reduce the amount of cancer. Also called preoperative treatment if given before an operation."
"160","neuroendocrine cells","A cell that receives signals from the nervous system to make and release hormones into the blood."
"161","neuroendocrine tumor (NET)","A tumor that starts in neuroendocrine cells."
"162","observation","A period of testing for changes in cancer status while not receiving treatment."
"163","palliative care","Health care that includes symptom relief but not cancer treatment. Also sometimes called supportive care."
"164","pancreas","An organ that makes fluids that help digest food and hormones that control blood sugar."
"165","pelvis","The body area between the hipbones."
"166","peptide receptor radionuclide therapy (PRRT)","A procedure that uses a radiopharmaceutical drug to target and treat certain neuroendocrine tumors."
"167","pineal gland","A small gland in the cerebrum of the brain."
"168","pituitary gland","An organ in the brain that controls certain body functions and other hormone glands. Also called the 'master gland'."
"169","primary treatment","The main treatment used to rid the body of cancer."
"170","progression","The growth or spread of cancer after being tested or treated."
"171","prostate","A male gland that makes fluid that protects sperm from the acid in the vagina."
"172","radiation therapy (RT)","A treatment that uses high-energy rays or related approaches to kill cancer cells."
"173","radiopharmaceutical","A drug that carries a certain amount of radioactive material."
"174","rectum","An organ that holds stool until expelled from the body."
"175","serotonin","A hormone that sends signals between nerve cells and controls things like mood, sleep, and memory."
"176","somatostatin","A peptide hormone that attaches to receptors and controls the endocrine system and nervous system."
"177","somatostatin receptor (SSTR) scintigraphy","A type of imaging scan used to assess carcinoid tumors that have somatostatin receptors."
"178","stomach","An organ of the digestive system that turns solid food into a more liquid form."
"179","testicle","One of a pair of egg-shaped glands found inside the sac between the legs of a man."
"180","thymus","A gland that is behind the breastbone."
"181","tumor marker","A substance found in body tissue or fluid that may be a sign of cancer."
"182","ulcer","A sore on the skin or mucous membrane in the body."
"183","vasoactive intestinal polypeptide (VIP)","A hormone that controls the amount of water and minerals absorbed into the small intestine during digestion."
"184","x-ray","A test that uses small amounts of radiation to make pictures of the insides of the body. Also called a plain radiograph."
"185","AJCC","American Joint Committee on Cancer."
"186","biomarker","Any molecule in your body that can be measured to assess your health."
"187","continuation maintenance","A treatment phase using one or more first-line drugs to prolong good treatment results."
"188","core needle biopsy","A procedure that removes tissue samples with a hollow needle. Also called core biopsy."
"189","DNA","Deoxyribonucleic acid."
"190","ECOG","Eastern Cooperative Oncology Group."
"191","gene rearrangement","A coded instruction within a cell that is made from parts of other coded instructions."
"192","immunohistochemistry (IHC)","A special lab test done on a tissue sample."
"193","maintenance therapy","A treatment phase that is given to prolong good treatment results."
"194","NOS","Not otherwise specified."
"195","performance status","A rating of one’s ability to do daily activities."
"196","pericardiocentesis","A procedure that removes fluid from around the heart with a needle."
"197","platinum-doublet chemotherapy","A treatment with two cell-killing drugs, one of which contains the chemical platinum."
"198","rapid on-site evaluation (ROSE)","A size assessment of removed tissue during a medical procedure."
"199","small cell lung cancer (SCLC)","A cancer of small, round lung cells."
"200","switch maintenance","A treatment phase with a new drug that is given to prolong good treatment results."
"201","trachea","The airway between the throat and airway into the lungs. Also called the windpipe."
"202","VATS","Video-assisted thoracoscopic surgery."
"203","ABCDE rule","A memory device for characteristics of moles or skin lesions that might be cancer."
"204","advanced melanoma","Cancer that has spread beyond the area near the main tumor."
"205","anesthesia","A drug or other substance that causes a controlled loss of feeling or awareness with or without loss of wakefulness."
"206","asymmetry","One half or side of the mole does not match the other half or side."
"207","best supportive care","Treatment given to prevent, control, or relieve side effects and improve comfort and quality of life."
"208","BRAF mutations","BRAF mutations can cause normal cells to become cancerous. They are most commonly found in melanomas but can occur in other forms of cancer."
"209","Breslow thickness","A measure of how deep the melanoma tumor has grown into the skin."
"210","broad-spectrum sunscreen","A substance that protects the skin from the sun by blocking 2 types of harmful ultraviolet (UV) rays — UVA and UVB."
"211","completion lymph node dissection (CLND)","A procedure to remove the lymph nodes after a positive sentinel lymph node biopsy."
"212","computed tomography (CT) scan","A test that uses x-rays from many angles to make a picture of the inside of the body."
"213","dermal mitotic rate","A measure of how many cancer cells are growing and dividing in the dermis."
"214","dermatologist","A doctor who’s an expert in skin diseases."
"215","dermis","The second layer of skin that is beneath the top layer (epidermis)."
"216","distant metastasis","Cancer cells have spread to a part of the body far away from the first (primary) melanoma tumor."
"217","DNA (deoxyribonucleic acid)","A long molecule that contains our unique genetic code."
"218","epidermis","The outer layer of skin."
"219","excision","Removal by surgery."
"220","excisional biopsy","Surgery that removes the entire skin tumor or abnormal-looking area (lesion) to test for cancer cells."
"221","fine-needle aspiration (FNA) biopsy","Use of a thin needle to remove fluid or tissue from the body to be tested for disease."
"222","follow-up tests","Tests done after treatment to check for signs of cancer return (recurrence) or spread (metastasis)."
"223","general anesthesia","A controlled loss of wakefulness from drugs."
"224","genes","A set of coded instructions in cells for making new cells and controlling how cells behave."
"225","infusion","A method of putting fluids, including drugs, into the bloodstream."
"226","in-transit metastases","Skin cancer spreads through a lymph vessel."
"227","lymphedema","Swelling due to buildup of lymph fluid in the fatty tissue just under the skin near the surgery site."
"228","lymph node basin","A group of lymph nodes that receives and filters lymph that flows from a certain area of the body."
"229","lymph vessels","Similar to blood vessels, lymph vessels are thin-walled and tube-like but carry a fluid called lymph."
"230","microsatellites","Tiny tumor deposits that have spread to lymph vessels in the skin near the first melanoma tumor and can only be seen with a microscope."
"231","resectable","Cancer able to be removed (resected) by surgery."
"232","sentinel lymph node biopsy (SLNB)","Surgery to find and remove a sentinel lymph node to see if it contains cancer cells."
"233","stereotactic radiosurgery (SRS)","A treatment that gives a single large dose of radiation concentrated on a tumor, while limiting the dose to surrounding organs."
"234","sun protection factor (SPF)","A number that indicates how well the sunscreen protects skin against sunburn."
"235","talimogene laherparepvec (T-VEC)","Treatment that uses a virus to infect and kill cancer cells while avoiding normal, healthy cells."
"236","tumor-infiltrating lymphocyte (TIL) therapy","Treatment where tumor-infiltrating lymphocytes are removed from the patient's tumor, grown in a laboratory, and given to the patient by infusion."
"237","ulceration","A break in the skin like an open sore."
"238","allogeneic hematopoietic cell transplant (allogenic HCT)","A cancer treatment that replaces abnormal blood stem cells with healthy donor cells."
"239","autologous hematopoietic cell transplant (autologous HCT)","A cancer treatment that destroys your bone marrow then rebuilds it with your healthy stem cells. Also called high-dose therapy with autologous stem cell rescue (HDT/ASCR)."
"240","biosimilar","A drug that is almost an identical drug made by another company. It has been approved by the U.S. Food and Drug Administration (FDA) and must be used in the exact same way and at the same dose as the other drug."
"241","bone marrow","The sponge-like tissue in the center of most bones."
"242","bone marrow aspiration","A procedure that removes a liquid bone marrow sample to test for a disease."
"243","bone marrow biopsy","A procedure that removes bone and solid bone marrow samples to test for a disease."
"244","complete response (CR)","No signs of lymphoma are found. Also called complete remission."
"245","flow cytometry (FCM)","A lab test of substances on the surface of cells to identify the type of cells present."
"246","fluorescence in situ hybridization (FISH)","A lab test that uses special dyes to look for abnormal chromosomes and genes."
"247","gastroenterologist","A doctor who’s an expert in digestive diseases."
"248","H. pylori (Helicobacter pylori)","A type of bacterium that causes inflammation and ulcers in the stomach or small intestine."
"249","hematopathologist","A doctor who specializes in the study of blood diseases and cancers using a microscope."
"250","hematopoietic cell transplant (HCT)","A cancer treatment that replaces abnormal blood stem cells with healthy cells."
"251","histology","The study of tissues and cells under a microscope."
